### ISSUE TITLE
TheHive webhook sends 6 times an alert creation

### ISSUE THREAD

**Issue by M3l0nPan** [TheHive-Project/TheHive#903]
### Request Type

Bug 

### Work Environment

| Question              | Answer
|---------------------------|--------------------
| OS version (server)       | RedHat
| TheHive version  | 3.2.1

### Problem Description

When creating an alert TheHive WebHook sends the alert creation event in duplicate.

### Steps to Reproduce
1. Start webhook example program
1. Create an alert
1. Look at results in webhook program stdout

### Complementary information

Network capture:

```
11:38:05.668136 IP localhost.39806 > localhost.45000: Flags [S], seq 3233123887, win 43690, options [mss 65495,sackOK,TS val 786478617 ecr 0,nop,wscale 7], length 0

11:38:15.718783 IP localhost.39826 > localhost.45000: Flags [S], seq 870848543, win 43690, options [mss 65495,sackOK,TS val 786488667 ecr 0,nop,wscale 7], length 0

11:38:25.773309 IP localhost.39834 > localhost.45000: Flags [S], seq 725416158, win 43690, options [mss 65495,sackOK,TS val 786498722 ecr 0,nop,wscale 7], length 0

11:38:35.822446 IP localhost.39842 > localhost.45000: Flags [S], seq 2351299660, win 43690, options [mss 65495,sackOK,TS val 786508771 ecr 0,nop,wscale 7], length 0

11:38:45.876185 IP localhost.39852 > localhost.45000: Flags [S], seq 4035842696, win 43690, options [mss 65495,sackOK,TS val 786518825 ecr 0,nop,wscale 7], length 0

11:38:55.928598 IP localhost.39864 > localhost.45000: Flags [S], seq 2332253516, win 43690, options [mss 65495,sackOK,TS val 786528877 ecr 0,nop,wscale 7], length 0
```

Note that the alert is sent 6 times, once every 10 seconds

Webhook python example sdtout:

```
[2019-02-28 11:38:05,671] INFO in controllers: Emit AlertCreation: Root=18e1aa0b307b2a2d5b046b23675bf70c, Details={"customFields": {}, "description": "N/A", "follow": true, "lastSyncDate": 1551350284915, "severity": 2, "status": "New", "title": "New alert", "tlp": 2}

[2019-02-28 11:38:15,721] INFO in controllers: Emit AlertCreation: Root=18e1aa0b307b2a2d5b046b23675bf70c, Details={"customFields": {}, "description": "N/A", "follow": true, "lastSyncDate": 1551350284915, "severity": 2, "status": "New", "title": "New alert", "tlp": 2}

[2019-02-28 11:38:25,776] INFO in controllers: Emit AlertCreation: Root=18e1aa0b307b2a2d5b046b23675bf70c, Details={"customFields": {}, "description": "N/A", "follow": true, "lastSyncDate": 1551350284915, "severity": 2, "status": "New", "title": "New alert", "tlp": 2}

[2019-02-28 11:38:35,825] INFO in controllers: Emit AlertCreation: Root=18e1aa0b307b2a2d5b046b23675bf70c, Details={"customFields": {}, "description": "N/A", "follow": true, "lastSyncDate": 1551350284915, "severity": 2, "status": "New", "title": "New alert", "tlp": 2}

[2019-02-28 11:38:45,878] INFO in controllers: Emit AlertCreation: Root=18e1aa0b307b2a2d5b046b23675bf70c, Details={"customFields": {}, "description": "N/A", "follow": true, "lastSyncDate": 1551350284915, "severity": 2, "status": "New", "title": "New alert", "tlp": 2}

[2019-02-28 11:38:55,931] INFO in controllers: Emit AlertCreation: Root=18e1aa0b307b2a2d5b046b23675bf70c, Details={"customFields": {}, "description": "N/A", "follow": true, "lastSyncDate": 1551350284915, "severity": 2, "status": "New", "title": "New alert", "tlp": 2}
```

Same Root_id for all his hooks

**Comment by nadouani** [comment]
What's the program you use to consume the webhooks? What's your webhook configuration.

I'm not able to reproduce.

**Comment by nadouani** [comment]
Sound like your Webhook consumer fails somehow and TheHive retries 6 times.

You should have some logs in your TheHive log file that look like

```
[error] s.W.XXXXXXXX - WebHook returns status XXX
[error] s.W.XXXXXXXX - WebHook returns status XXX
[error] s.W.XXXXXXXX - WebHook returns status XXX
[error] s.W.XXXXXXXX - WebHook returns status XXX
[error] s.W.XXXXXXXX - WebHook returns status XXX
[error] s.W.XXXXXXXX - WebHook returns status XXX
```
